{
  "schema_version": "mcp-doctor.aggregate/v1",
  "schema_stability": "stable",
  "outcome": "passed",
  "exit_code": 0,
  "limits": {
    "input_files": 32,
    "input_file_bytes": 4194304,
    "input_bytes": 16777216,
    "json_depth": 64,
    "json_nodes": 1000000,
    "validation_work": 1000000,
    "checks": 4096,
    "findings": 2048,
    "rendered_bytes": 8388608,
    "total_ms": 10000,
    "retries": 0,
    "concurrency": 1
  },
  "summary": {
    "members": 1,
    "passed": 1,
    "failed": 0,
    "incomplete": 0
  },
  "members": [
    {
      "ordinal": 0,
      "report": {
        "schema_version": "mcp-doctor.report/v1",
        "schema_stability": "stable",
        "protocol_revision": "2026-07-28",
        "primary_diagnosis": null,
        "independent_findings": [],
        "outcome": "passed",
        "exit_code": 0,
        "limits": {
          "startup_ms": 10000,
          "discovery_ms": 10000,
          "request_ms": 30000,
          "response_ms": 30000,
          "shutdown_grace_ms": 2000,
          "total_ms": 120000,
          "message_bytes": 1048576,
          "stdout_bytes": 8388608,
          "stderr_bytes": 1048576,
          "aggregate_output_bytes": 8388608,
          "endpoint_bytes": 8192,
          "resolution_addresses": 16,
          "resolution_count": 1,
          "trust_bytes": 1048576,
          "trust_certificates": 32,
          "request_fields": 64,
          "request_field_name_bytes": 256,
          "request_field_value_bytes": 8192,
          "request_fields_bytes": 32768,
          "response_fields": 96,
          "response_field_name_bytes": 256,
          "response_field_value_bytes": 16384,
          "response_fields_bytes": 65536,
          "message_count": 1024,
          "protocol_revisions": 32,
          "catalog_items": 10000,
          "schema_bytes": 1048576,
          "instance_bytes": 1048576,
          "schema_nodes": 100000,
          "schema_depth": 64,
          "schema_ref_depth": 32,
          "schema_evaluation_steps": 100000,
          "validation_errors": 100,
          "report_findings": 256,
          "report_bytes": 4194304,
          "active_cases": 100,
          "generation_attempts": 256,
          "generation_candidates": 64,
          "generation_steps": 100000,
          "redirects": 0,
          "retries": 0,
          "concurrency": 1
        },
        "summary": {
          "checks": 1,
          "required": 1,
          "optional": 0,
          "performed": 1,
          "skipped": 0,
          "passed": 1,
          "warned": 0,
          "failed": 0,
          "required_skipped": 0,
          "findings": {
            "info": 0,
            "warning": 0,
            "error": 0,
            "critical": 0
          }
        },
        "checks": [
          {
            "id": "protocol.revision",
            "requirement": "required",
            "state": "performed",
            "outcome": "passed",
            "findings": []
          }
        ]
      }
    }
  ]
}
